{"deterministic_algorithms":true,"dtypes":{"model":"float32","normalization_statistics":"float64","normalized_features":"float32"},"libraries":{"blas_version":"accelerate:unknown","numpy_version":"2.5.2","python_version":"3.14.3","pytorch_version":"2.13.0","uv_lock_sha256":"80bb57210d1dc94669e7a0b5eb0f7bf5ded4e7255d9c4790b880a9cc829b0af6"},"platform":{"cpu_brand":"Apple M4","machine_architecture":"arm64","operating_system_build":"Darwin Kernel Version 25.6.0: Fri Jul 31 19:11:03 PDT 2026; root:xnu-12377.161.14~5/RELEASE_ARM64_T8132","operating_system_name":"Darwin","operating_system_version":"26.6.2"},"runtime_version":1,"threads":{"environment":{"MKL_NUM_THREADS":"1","OMP_NUM_THREADS":"1","OPENBLAS_NUM_THREADS":"1","VECLIB_MAXIMUM_THREADS":"1"},"torch_interop":1,"torch_intraop":1}}
